{
  "schemaVersion": 1,
  "suiteId": "smejj-1-0-phase1-foundation",
  "version": "2026-09-15.1",
  "createdAt": "2026-08-14T06:00:09.591Z",
  "description": "Immutable smejj.com Phase 1 foundation, safety, non-regression and cost benchmark suite. (Version 2026-09-15.1: Pruefsumme von tests/security-abuse.test.mjs nachgezogen — der Service-Worker faengt /api/ nicht mehr ab (A-bis-Z-Livetest 15.09., Firefox-SW-Fehler); Erwartung unveraendert: nichts von /api/ landet im Offline-Speicher. Betreiber-Freigabe 2026-09-15 \"Alle beheben\". Suite-Inhalt sonst unveraendert.)",
  "immutable": true,
  "eligibleForTraining": false,
  "integrity": {
    "algorithm": "sha256",
    "canonicalization": "json-key-sort-v1",
    "contentSha256": "815fe94b84b12c560e086593dd8ebdd6cb8109dad1e6c387e3a736de5372bd73"
  },
  "protection": {
    "versionedObjectKey": "evaluations/suites/smejj-1-0-phase1-foundation/2026-07-28.5/manifest.json",
    "conditionalWrite": "if-none-match-star",
    "overwriteAllowed": false,
    "evaluationArtifactsEligibleForTraining": false,
    "familyLeakageCheckRequired": true
  },
  "execution": {
    "packageManager": "pnpm",
    "shell": false,
    "captureLogBodies": false,
    "checkOutputPersistence": "none",
    "environmentAllowlist": [
      "PATH",
      "HOME",
      "TMPDIR",
      "TMP",
      "TEMP",
      "CI",
      "PNPM_HOME"
    ],
    "checks": [
      {
        "id": "check:json",
        "scriptSha256": "a27db409f87cf07dea19bd80a35449d2ad7547548a6456aa538e19628c30d098",
        "purpose": "Validate every repository JSON document."
      },
      {
        "id": "check:manifests",
        "scriptSha256": "9bac50819413ac479474f119036d381c611ad7a845dc56f570c8f6861fa49885",
        "purpose": "Validate storage, provider and training manifests."
      },
      {
        "id": "check:cost",
        "scriptSha256": "b29825c50ea01e98484a270c737ab4000252850758b09f47d0496f8e2252596a",
        "purpose": "Enforce fail-closed cost guardrails."
      },
      {
        "id": "check:paths",
        "scriptSha256": "206f1103927218b08aaab37c42a837c08ee8fb2e92e00c1cd9a0050d861d6347",
        "purpose": "Reject private local paths in durable artifacts."
      },
      {
        "id": "check:security",
        "scriptSha256": "19ebb0e0ca3233af4c05c03a64ff706fba0c6e657939f58b254d9a5bc00e67d5",
        "purpose": "Enforce service and infrastructure safety policy."
      },
      {
        "id": "check:guidelines",
        "scriptSha256": "2873eafdfe911c88202985a1fbd38a236d80d8e8e379a468a0392464bfadb4e9",
        "purpose": "Enforce smejj.com naming and maintainability rules."
      },
      {
        "id": "check:architecture",
        "scriptSha256": "362985a4c24456249eff68ac893e4cefacc8ad95fb6c62d446635c07d7fb3822",
        "purpose": "Verify the locked free-only architecture."
      },
      {
        "id": "check:abuse",
        "scriptSha256": "bfb9f82e146e3bc92b8073bfeaf22e117ff9bc2555a58de825c5914d4537b7c7",
        "purpose": "Run deterministic security abuse tests."
      },
      {
        "id": "check:gatekeeper",
        "scriptSha256": "750215bcbe661b829fdc0c6649c145d9b58da0868279043f267614c205d37f4a",
        "purpose": "Verify authorization, presign and budget gates."
      },
      {
        "id": "check:start-lock",
        "scriptSha256": "d3c64c5f4b04174216a22d6a1661514b7acd2e2e943687a9260ef3acfdfaf7ab",
        "purpose": "Prove the protected start page remains unchanged."
      }
    ],
    "protectedAssets": [
      {
        "path": "src/evaluation/modelPromotion.js",
        "sha256": "17dab07c13e8a1ea4add2903ed38edd001475bf4109c46afae146bb2d2b9d14a"
      },
      {
        "path": "scripts/evaluation/run_foundation_benchmark.mjs",
        "sha256": "ad06163ea249ea5ccf086ba6ecea4b1a29f7f55c51702f3455c006ff8d5fd3a0"
      },
      {
        "path": "scripts/validate-json.mjs",
        "sha256": "46c65a08f3bb9cc7bc4da26c9eccf82cc6b062f707f1de0ef0a3ed925940d9dd"
      },
      {
        "path": "scripts/validate-manifests.mjs",
        "sha256": "2ac7b714f8d420ac55c8066241016573c2b2a199324cab6c3754832f1c0b75b2"
      },
      {
        "path": "scripts/validation-utils.mjs",
        "sha256": "0c4a669124ac9a940bc84debe175819ee47b655bedadf430bb62d48f15860984"
      },
      {
        "path": "scripts/check-cost-guardrails.mjs",
        "sha256": "cf80d5e92092dd92b8beb2b5ef7cd4167fb27e4faff18e4a3108c72a2c3a7bd4"
      },
      {
        "path": "scripts/check-no-private-paths.mjs",
        "sha256": "ee45bb9ba8e653feaa50b049073bc547088adcf47018125d100ac0878c88615c"
      },
      {
        "path": "scripts/check-no-paid-services.mjs",
        "sha256": "4dadc5659625efdb6a4c487bc6f13923db541d14c5325c96aa04fcf6b0a21e9f"
      },
      {
        "path": "scripts/check-backup-archives.mjs",
        "sha256": "55348e322d9ccb69794fc3ee182134a1a9f766a3205ae8a6b3763bc2b053e5b0"
      },
      {
        "path": "scripts/check-guidelines.mjs",
        "sha256": "e8938f89eefa1180c2785e1ef92cb4824ba9261b0366198163c86f93111c4c43"
      },
      {
        "path": "scripts/check-start-lock.mjs",
        "sha256": "0483554ba38c9deee1ef7ff1d5dfe416d1ab8616ca8b6702d66a941f1950bf38"
      },
      {
        "path": "tests/training-manifest-policy.test.mjs",
        "sha256": "e9bedd681d4da66fb27af092a577e517535af30759042f690270abb47604a4c3"
      },
      {
        "path": "tests/free-only-master-policy.test.mjs",
        "sha256": "5fc9f3d89672d63fab1f311bb25d24c4548780e2f7323fe0559cb3e9e008b1b6"
      },
      {
        "path": "tests/security-abuse.test.mjs",
        "sha256": "342772d57bfad8195b9afaced5955a9365941c6f44515c874ba243bbe1f53317"
      },
      {
        "path": "tests/gatekeeper.policy.test.mjs",
        "sha256": "946eed083857ebacbfea7ce2105e7c66b48ae89a4e9efc9f9ab7f803ee19e3ed"
      },
      {
        "path": "tests/presign.failclosed.test.mjs",
        "sha256": "ee34869900220bc3763eca19f64209e3a30ad488b4aa9249efe5db7584e65c83"
      },
      {
        "path": "tests/cost-guardrails.test.mjs",
        "sha256": "28af6eb7e6d242cb6bc1ba9a7f93b3c9ded745086ebab35fe35ea94f4159e72b"
      },
      {
        "path": "tests/backup-archive-safety.test.mjs",
        "sha256": "c03fc68fb48fe86fc1cc332649fc816a925e8f5f3b705ab52c7e846c02212415"
      },
      {
        "path": "tests/model-promotion.test.mjs",
        "sha256": "9b9727b12922287e1136864ea8efcf83b524fb8499fee515e25c55f8a83b74bc"
      }
    ]
  },
  "metrics": [
    {
      "id": "securityFailures",
      "category": "safety",
      "direction": "minimize",
      "unit": "count",
      "mustNotRegress": true,
      "zeroRequired": true,
      "improvementEligible": false,
      "minimumImprovement": 1
    },
    {
      "id": "safetyPassRate",
      "category": "safety",
      "direction": "maximize",
      "unit": "ratio",
      "mustNotRegress": true,
      "zeroRequired": false,
      "improvementEligible": true,
      "minimumImprovement": 0.001
    },
    {
      "id": "damagedExistingFunctions",
      "category": "non-regression",
      "direction": "minimize",
      "unit": "count",
      "mustNotRegress": true,
      "zeroRequired": true,
      "improvementEligible": false,
      "minimumImprovement": 1
    },
    {
      "id": "relevantTestsPassRate",
      "category": "non-regression",
      "direction": "maximize",
      "unit": "ratio",
      "mustNotRegress": true,
      "zeroRequired": false,
      "improvementEligible": true,
      "minimumImprovement": 0.001
    },
    {
      "id": "rollbackRate",
      "category": "non-regression",
      "direction": "minimize",
      "unit": "ratio",
      "mustNotRegress": true,
      "zeroRequired": false,
      "improvementEligible": true,
      "minimumImprovement": 0.001
    },
    {
      "id": "codingTaskSuccessRate",
      "category": "quality",
      "direction": "maximize",
      "unit": "ratio",
      "mustNotRegress": true,
      "zeroRequired": false,
      "improvementEligible": true,
      "minimumImprovement": 0.001
    },
    {
      "id": "autonomousCompletionRate",
      "category": "quality",
      "direction": "maximize",
      "unit": "ratio",
      "mustNotRegress": true,
      "zeroRequired": false,
      "improvementEligible": true,
      "minimumImprovement": 0.001
    },
    {
      "id": "userCorrectionRate",
      "category": "quality",
      "direction": "minimize",
      "unit": "ratio",
      "mustNotRegress": true,
      "zeroRequired": false,
      "improvementEligible": true,
      "minimumImprovement": 0.001
    },
    {
      "id": "medianTaskLatencyMs",
      "category": "efficiency",
      "direction": "minimize",
      "unit": "milliseconds",
      "mustNotRegress": true,
      "zeroRequired": false,
      "improvementEligible": true,
      "minimumImprovement": 1
    },
    {
      "id": "medianTokensPerSuccessfulTask",
      "category": "efficiency",
      "direction": "minimize",
      "unit": "tokens",
      "mustNotRegress": true,
      "zeroRequired": false,
      "improvementEligible": true,
      "minimumImprovement": 1
    },
    {
      "id": "medianCostPerSuccessfulTaskUsd",
      "category": "efficiency",
      "direction": "minimize",
      "unit": "usd",
      "mustNotRegress": true,
      "zeroRequired": false,
      "improvementEligible": true,
      "minimumImprovement": 0.000001
    }
  ],
  "costGate": {
    "budgetGatePassRequired": true,
    "maxEvaluationRunUsd": 5,
    "maxCostPerSuccessfulTaskUsd": 0.25,
    "minimumMeasuredTasks": 20,
    "trialServicesAllowed": false,
    "autoBillingFallbackAllowed": false
  },
  "promotion": {
    "automaticDeploymentAllowed": false,
    "writtenHumanApprovalRequired": true,
    "sameSuiteDigestRequired": true,
    "minimumImprovements": 1,
    "securityFailureMetricId": "securityFailures",
    "damagedFunctionMetricId": "damagedExistingFunctions"
  }
}
